{
  "$schema": "../schemas/retirement-manifest-v1.schema.json",
  "schema_version": 1,
  "function_slug": "momi-orders-get-by-guid-v1",
  "owner_service": "toast-order-read-api",
  "reason": "Legacy development reader retained while caller absence is verified.",
  "replacement": "momi-toast-orders-get-by-id-v1",
  "environments": ["dev"],
  "remove_after": "2026-07-27"
}
